{
  "chain_id": "F7.2-formal-validation",
  "generated_at": "2026-06-12T00:00:00Z",
  "gates": [
    {
      "gate_id": "F7.0-logical-reconcile",
      "stage": 0,
      "commit": "e636dcfa",
      "parent_commit": "1f20dc1b",
      "status": "MERGED_AND_SEALED",
      "scope": "Reconcile F7.1 logical order with parent route history",
      "allowed_next_entries": ["F7.2-planning-review"],
      "blocked_actions": [],
      "evidence_refs": ["ev-F7.0-001"],
      "created_at": "2026-05-25T00:00:00Z",
      "human_decision_required": false,
      "promotion_allowed": false,
      "alpha_claim_allowed": false,
      "runner_enabled": false,
      "paper_trading_allowed": false,
      "production": false,
      "broker_runtime": "none",
      "real_trade": false
    },
    {
      "gate_id": "F7.2-planning-review",
      "stage": 1,
      "commit": "e1373225",
      "parent_commit": "e636dcfa",
      "status": "MERGED_AND_SEALED",
      "scope": "F7.2 U475 6-month validation planning review gate",
      "allowed_next_entries": ["F7.2-execution-plan"],
      "blocked_actions": ["factor_promotion", "alpha_claim", "production_deploy"],
      "evidence_refs": ["ev-F7.2-plan-001"],
      "created_at": "2026-05-26T00:00:00Z",
      "human_decision_required": true,
      "promotion_allowed": false,
      "alpha_claim_allowed": false,
      "runner_enabled": false,
      "paper_trading_allowed": false,
      "production": false,
      "broker_runtime": "none",
      "real_trade": false
    },
    {
      "gate_id": "F7.2-execution-plan",
      "stage": 2,
      "commit": "6de8802d",
      "parent_commit": "e1373225",
      "status": "MERGED_AND_SEALED",
      "scope": "F7.2 formal validation execution plan gate",
      "allowed_next_entries": ["F7.2-execution-auth"],
      "blocked_actions": ["factor_promotion", "alpha_claim", "production_deploy", "validation_run"],
      "evidence_refs": ["ev-F7.2-exec-001"],
      "created_at": "2026-05-27T00:00:00Z",
      "human_decision_required": true,
      "promotion_allowed": false,
      "alpha_claim_allowed": false,
      "runner_enabled": false,
      "paper_trading_allowed": false,
      "production": false,
      "broker_runtime": "none",
      "real_trade": false
    },
    {
      "gate_id": "F7.2-execution-auth",
      "stage": 3,
      "commit": "c1d1e38d",
      "parent_commit": "6de8802d",
      "status": "MERGED_AND_SEALED",
      "scope": "Update execution plan gate base commit to approval SHA",
      "allowed_next_entries": ["F7.2-final-exec-auth"],
      "blocked_actions": ["factor_promotion", "alpha_claim", "production_deploy", "validation_run"],
      "evidence_refs": ["ev-F7.2-exec-auth-001"],
      "created_at": "2026-05-28T00:00:00Z",
      "human_decision_required": true,
      "promotion_allowed": false,
      "alpha_claim_allowed": false,
      "runner_enabled": false,
      "paper_trading_allowed": false,
      "production": false,
      "broker_runtime": "none",
      "real_trade": false
    },
    {
      "gate_id": "F7.2-final-exec-auth",
      "stage": 4,
      "commit": "2448124e",
      "parent_commit": "c1d1e38d",
      "status": "MERGED_AND_SEALED",
      "scope": "F7.2 final execution authorization gate",
      "allowed_next_entries": ["F7.2-human-val-auth"],
      "blocked_actions": ["factor_promotion", "alpha_claim", "production_deploy", "validation_run"],
      "evidence_refs": ["ev-F7.2-final-auth-001"],
      "created_at": "2026-05-29T00:00:00Z",
      "human_decision_required": true,
      "promotion_allowed": false,
      "alpha_claim_allowed": false,
      "runner_enabled": false,
      "paper_trading_allowed": false,
      "production": false,
      "broker_runtime": "none",
      "real_trade": false
    },
    {
      "gate_id": "F7.2-human-val-auth",
      "stage": 5,
      "commit": "597aaa32",
      "parent_commit": "2448124e",
      "status": "MERGED_AND_SEALED",
      "scope": "F7.2 human formal validation run authorization decision gate",
      "allowed_next_entries": ["F7.2-val-readonly"],
      "blocked_actions": ["factor_promotion", "alpha_claim", "production_deploy", "validation_run"],
      "evidence_refs": ["ev-F7.2-human-val-001"],
      "created_at": "2026-05-30T00:00:00Z",
      "human_decision_required": true,
      "promotion_allowed": false,
      "alpha_claim_allowed": false,
      "runner_enabled": false,
      "paper_trading_allowed": false,
      "production": false,
      "broker_runtime": "none",
      "real_trade": false
    },
    {
      "gate_id": "F7.2-val-readonly",
      "stage": 6,
      "commit": "ea80ff9a",
      "parent_commit": "597aaa32",
      "status": "MERGED_AND_SEALED",
      "scope": "Run F7.2 formal validation in readonly mode",
      "allowed_next_entries": ["F7.2-val-audit"],
      "blocked_actions": ["factor_promotion", "alpha_claim", "production_deploy"],
      "evidence_refs": ["ev-F7.2-val-run-001"],
      "created_at": "2026-06-01T00:00:00Z",
      "human_decision_required": false,
      "promotion_allowed": false,
      "alpha_claim_allowed": false,
      "runner_enabled": true,
      "paper_trading_allowed": false,
      "production": false,
      "broker_runtime": "none",
      "real_trade": false
    },
    {
      "gate_id": "F7.2-val-audit",
      "stage": 7,
      "commit": "b9f77abb",
      "parent_commit": "ea80ff9a",
      "status": "MERGED_AND_SEALED",
      "scope": "Audit F7.2 formal validation results",
      "allowed_next_entries": ["F7.2-safety-patch"],
      "blocked_actions": ["factor_promotion", "alpha_claim", "production_deploy"],
      "evidence_refs": ["ev-F7.2-audit-001"],
      "created_at": "2026-06-02T00:00:00Z",
      "human_decision_required": true,
      "promotion_allowed": false,
      "alpha_claim_allowed": false,
      "runner_enabled": false,
      "paper_trading_allowed": false,
      "production": false,
      "broker_runtime": "none",
      "real_trade": false
    },
    {
      "gate_id": "F7.2-safety-patch",
      "stage": 8,
      "commit": "18429840",
      "parent_commit": "b9f77abb",
      "status": "MERGED_AND_SEALED",
      "scope": "Patch F7.2 result audit safety field semantics",
      "allowed_next_entries": ["F7.2-human-interpret"],
      "blocked_actions": ["factor_promotion", "alpha_claim", "production_deploy"],
      "evidence_refs": ["ev-F7.2-safety-001"],
      "created_at": "2026-06-03T00:00:00Z",
      "human_decision_required": false,
      "promotion_allowed": false,
      "alpha_claim_allowed": false,
      "runner_enabled": false,
      "paper_trading_allowed": false,
      "production": false,
      "broker_runtime": "none",
      "real_trade": false
    },
    {
      "gate_id": "F7.2-human-interpret",
      "stage": 9,
      "commit": "4dcef2ab",
      "parent_commit": "18429840",
      "status": "MERGED_AND_SEALED",
      "scope": "F7.2 human interpretation review",
      "allowed_next_entries": ["F7.2-decision-gate"],
      "blocked_actions": ["factor_promotion", "alpha_claim", "production_deploy"],
      "evidence_refs": ["ev-F7.2-interpret-001"],
      "created_at": "2026-06-04T00:00:00Z",
      "human_decision_required": true,
      "promotion_allowed": false,
      "alpha_claim_allowed": false,
      "runner_enabled": false,
      "paper_trading_allowed": false,
      "production": false,
      "broker_runtime": "none",
      "real_trade": false
    },
    {
      "gate_id": "F7.2-decision-gate",
      "stage": 10,
      "commit": "03c8de6e",
      "parent_commit": "4dcef2ab",
      "status": "MERGED_AND_SEALED",
      "scope": "F7.2 human interpretation review decision gate — final gate",
      "allowed_next_entries": [],
      "blocked_actions": ["factor_promotion", "alpha_claim", "production_deploy", "paper_trading"],
      "evidence_refs": ["ev-F7.2-decision-001"],
      "created_at": "2026-06-05T00:00:00Z",
      "human_decision_required": true,
      "promotion_allowed": false,
      "alpha_claim_allowed": false,
      "runner_enabled": false,
      "paper_trading_allowed": false,
      "production": false,
      "broker_runtime": "none",
      "real_trade": false
    }
  ],
  "chain_summary": {
    "total_gates": 11,
    "passed": 11,
    "blocked": 0,
    "pending": 0,
    "merged_and_sealed": 11,
    "degraded": 0
  }
}
